{
  "$id": "https://gen-chart.dev/schemas/cartesian.schema.json",
  "$schema": "https://json-schema.org/draft/2020-12/schema",
  "type": "object",
  "additionalProperties": false,
  "required": [
    "schema_version",
    "chart_type",
    "meta",
    "data",
    "encoding",
    "series"
  ],
  "properties": {
    "schema_version": {
      "const": 1
    },
    "chart_type": {
      "const": "cartesian"
    },
    "orientation": {
      "enum": [
        "vertical",
        "horizontal"
      ]
    },
    "meta": {
      "type": "object",
      "additionalProperties": false,
      "required": [
        "title"
      ],
      "properties": {
        "title": {
          "$ref": "common.schema.json#/$defs/shortText"
        },
        "subtitle": {
          "$ref": "common.schema.json#/$defs/shortText"
        },
        "quality_profile": {
          "$ref": "common.schema.json#/$defs/qualityProfile"
        },
        "theme": {
          "$ref": "common.schema.json#/$defs/theme"
        },
        "locale": {
          "$ref": "common.schema.json#/$defs/locale"
        },
        "width": {
          "type": "integer",
          "minimum": 640,
          "maximum": 1600
        },
        "height": {
          "type": "integer",
          "minimum": 360,
          "maximum": 1200
        },
        "views": {
          "$ref": "common.schema.json#/$defs/guidedViews"
        }
      }
    },
    "data": {
      "type": "object",
      "additionalProperties": false,
      "required": [
        "columns"
      ],
      "properties": {
        "columns": {
          "type": "array",
          "minItems": 1,
          "maxItems": 12,
          "items": {
            "$ref": "common.schema.json#/$defs/column"
          }
        }
      }
    },
    "encoding": {
      "type": "object",
      "additionalProperties": false,
      "required": [
        "x",
        "y"
      ],
      "properties": {
        "x": {
          "type": "object",
          "additionalProperties": false,
          "required": [
            "column",
            "scale"
          ],
          "properties": {
            "column": {
              "$ref": "common.schema.json#/$defs/id"
            },
            "scale": {
              "enum": [
                "linear",
                "time",
                "band"
              ]
            },
            "label": {
              "$ref": "common.schema.json#/$defs/shortText"
            },
            "context": {
              "type": "object",
              "additionalProperties": false,
              "required": [
                "column"
              ],
              "properties": {
                "column": {
                  "$ref": "common.schema.json#/$defs/id"
                },
                "label": {
                  "$ref": "common.schema.json#/$defs/shortText"
                }
              }
            }
          }
        },
        "y": {
          "type": "object",
          "additionalProperties": false,
          "properties": {
            "scale": {
              "enum": [
                "linear",
                "log"
              ]
            },
            "zero": {
              "type": "boolean"
            },
            "label": {
              "$ref": "common.schema.json#/$defs/shortText"
            }
          }
        }
      }
    },
    "series": {
      "type": "array",
      "minItems": 1,
      "maxItems": 8,
      "items": {
        "type": "object",
        "additionalProperties": false,
        "required": [
          "id",
          "mark",
          "label"
        ],
        "properties": {
          "id": {
            "$ref": "common.schema.json#/$defs/id"
          },
          "mark": {
            "enum": [
              "line",
              "bar",
              "scatter",
              "bubble",
              "area",
              "range"
            ]
          },
          "y": {
            "$ref": "common.schema.json#/$defs/id"
          },
          "lower": {
            "$ref": "common.schema.json#/$defs/id"
          },
          "upper": {
            "$ref": "common.schema.json#/$defs/id"
          },
          "meaning": {
            "$ref": "common.schema.json#/$defs/shortText"
          },
          "label": {
            "$ref": "common.schema.json#/$defs/shortText"
          },
          "role": {
            "$ref": "common.schema.json#/$defs/colorRole"
          },
          "point": {
            "type": "boolean"
          },
          "size": {
            "$ref": "common.schema.json#/$defs/id"
          },
          "color_by": {
            "enum": [
              "sign"
            ]
          },
          "value_labels": {
            "enum": [
              "auto",
              "always",
              "off"
            ]
          },
          "details": {
            "type": "array",
            "maxItems": 3,
            "items": {
              "type": "object",
              "additionalProperties": false,
              "required": [
                "column"
              ],
              "properties": {
                "column": {
                  "$ref": "common.schema.json#/$defs/id"
                },
                "label": {
                  "$ref": "common.schema.json#/$defs/shortText"
                }
              }
            }
          }
        },
        "allOf": [
          {
            "if": {
              "properties": {
                "mark": {
                  "const": "range"
                }
              },
              "required": [
                "mark"
              ]
            },
            "then": {
              "required": [
                "lower",
                "upper"
              ],
              "properties": {
                "lower": {
                  "$ref": "common.schema.json#/$defs/id"
                },
                "upper": {
                  "$ref": "common.schema.json#/$defs/id"
                },
                "y": false,
                "point": false,
                "size": false
              }
            },
            "else": {
              "required": [
                "y"
              ],
              "properties": {
                "y": {
                  "$ref": "common.schema.json#/$defs/id"
                },
                "lower": false,
                "upper": false,
                "meaning": false
              }
            }
          }
        ]
      }
    },
    "annotations": {
      "type": "array",
      "maxItems": 6,
      "items": {
        "type": "object",
        "additionalProperties": false,
        "required": [
          "id",
          "kind",
          "at"
        ],
        "properties": {
          "id": {
            "$ref": "common.schema.json#/$defs/id"
          },
          "kind": {
            "enum": [
              "x-line",
              "y-line"
            ]
          },
          "at": {
            "type": [
              "number",
              "string"
            ]
          },
          "label": {
            "$ref": "common.schema.json#/$defs/shortText"
          }
        }
      }
    },
    "interactions": {
      "type": "object",
      "additionalProperties": false,
      "properties": {
        "tooltip": {
          "enum": [
            "auto",
            "off"
          ]
        },
        "legend_toggle": {
          "type": "boolean"
        },
        "brush": {
          "enum": [
            "x"
          ]
        }
      }
    },
    "cards": {
      "$ref": "common.schema.json#/$defs/cards"
    },
    "stack": {
      "enum": [
        true,
        false,
        "percent"
      ]
    }
  }
}
